ushe_rule,description,type,status,steward,ushe_notes,activity_date,banner,ref_rule
R06a,Missing Room group,Database,Failure,Vicki Shurtz,R_Group1 missing,room_activity_date,space_utlz.rooms_detail.room_group1_desc,R06a
R06b,Invalid room group,Database,Failure,Vicki Shurtz,R_Group1 not in Reference table,room_activity_date,space_utlz.rooms_detail.room_group1_desc,R06b
R07a,Missing room use category when r_group1 not Z,Database,Failure,Vicki Shurtz,R_Use_Category missing,room_activity_date,space_utlz.rooms_detail.room_use_code_group,R07a
R07b,Invalid room use category,Database,Failure,Vicki Shurtz,R_Use_Category not in Reference table,room_activity_date,space_utlz.rooms_detail.room_use_code_group,R07b
R07c,Missing room use category when r_group1 = Z,Database,Failure,Vicki Shurtz,R_Use_Category missing,room_activity_date,space_utlz.rooms_detail.room_use_code_group,R07c
R08a,Missing room use code,Database,Failure,Vicki Shurtz,R_Use_Code missing,room_activity_date,space_utlz.rooms_detail.room_use_code,R08a
R08b,Invalid room use code,Database,Failure,Vicki Shurtz,R_Use_Code Unknown not in Reference table,room_activity_date,space_utlz.rooms_detail.room_use_code,R08b
R08d,Invalid Room use code,Database,Failure,Vicki Shurtz,Room Use Code 250 and 255 only for UU and USU,room_activity_date,space_utlz.rooms_detail.room_use_code,R08d
R09a,Missing room name,Database,Failure,Vicki Shurtz,R_Name missing,room_activity_date,space_utlz.rooms_detail.room_name,R09a
R10a,"Missing room stations when r_use_code 110, 210, 230",Database,Failure,Vicki Shurtz,"R_Stations missing for R_Use_Code 110, 210, 230",room_activity_date,space_utlz.rooms_detail.room_stations,R10a
R10b,"Invalid room stations when r_use_code 110, 210, 230",Database,Failure,Vicki Shurtz,"R_Stations Invalid for R_Use_Code 110, 210, 230",room_activity_date,space_utlz.rooms_detail.room_stations,R10b
R10c,Stations out of range when r_use_code 110,Database,Warning,Vicki Shurtz,R_Stations out of range where r_use_code = 110,room_activity_date,space_utlz.rooms_detail.room_stations,R10c
R10d,Stations out of range when r_use_code 210,Database,Warning,Vicki Shurtz,R_Stations out of range where r_use_code = 210,room_activity_date,space_utlz.rooms_detail.room_stations,R10d
R11a,Missing room area,Database,Failure,Vicki Shurtz,R_Area missing,room_activity_date,space_utlz.rooms_detail.room_area,R11a
R11b,Invalid room area,Database,Failure,Vicki Shurtz,R_Area Invalid,room_activity_date,space_utlz.rooms_detail.room_area,R11b
R13a,Invalid proration,Database,Failure,Vicki Shurtz,R_Proration Not Y or N,room_activity_date,space_utlz.room_prorated,R13a
R13b,Missing proration,Database,Failure,Vicki Shurtz,R_Proration missing,room_activity_date,space_utlz.room_prorated,R13b
R13c,Prorated room area and prorated area equals zero,Database,Failure,Vicki Shurtz,"R_Proration = Y, R_Area and R_Prorated_area = 0",room_activity_date,space_utlz.room_prorated,R13c
R13d,"Prorated room area does not equal zero, but room area equals zero",Database,Failure,Vicki Shurtz,"R_Proration = Y, R_Area = 0 and R_Prorated_area <> 0",room_activity_date,space_utlz.room_prorated,R13d
R13e,"Prorated room area equals zero, but room area does not equal zero",Database,Failure,Vicki Shurtz,"R_Proration = Y, R_Area <> 0 and R_Prorated_area = 0",room_activity_date,space_utlz.room_prorated,R13e
R13f,"Proration equals N, but prorated area does not equal zero",Database,Failure,Vicki Shurtz,"R_Proration = N, R_Prorated_area <> 0",room_activity_date,space_utlz.room_prorated,R13f
R14a,Missing prorated area,Database,Failure,Vicki Shurtz,R_Prorated_Area can not be null,room_activity_date,space_utlz.room_prorated_area,R14a
R14b,Sum of prorated area is not equal to room area,Database,Failure,Vicki Shurtz,R_Prorated_Area Not Equal R_Area,room_activity_date,space_utlz.room_prorated_area,R14b
R15a,Invalid Date Format,Database,Failure,Vicki Shurtz,R_Update_Date wrong format,room_activity_date,room_activity_date,R15a
R15b,Missing activity date,Database,Failure,Vicki Shurtz,R_Update_Date blank list,room_activity_date,room_activity_date,R15b
R15c,Update date is in the future,Database,Failure,Vicki Shurtz,R_Update_Date is in the future,room_activity_date,room_activity_date,R15c
R99a,Duplicate records,USHE,Failure,NA,Looking for duplicate r_keys,room_activity_date,NA,R99a
UTS01,Invalid residency code,Database,Failure,Julie Stender,"Looking for values of ""R"", ""N"", ""A"", ""M"", ""G"", ""C""",sgbstdn_activity_date,sgbstdn_resd_code,S15a
UTS02,invalid pell awarded to highschool students,Database,Failure,Julie Stender,HS students should not have pell,rpratrm_activity_date,banner.rpratrm_offer_amt,S44c
UTC01,invalid delivery method,Database,Failure,Vicki Shurtz,Checking for valid values IN instruction_method_code,ssbsect_activity_date,banner.ssbsect_insm_code,C12
